{
  "$schema": "../scenario.schema.json",
  "schemaVersion": "1.0",
  "id": "sample-doorstep",
  "version": 3,
  "status": "published",
  "title": "A conversation at the door",
  "subtitle": "Practise a short doorstep conversation about faith and hope.",
  "estimatedMinutes": 5,
  "difficulty": "beginner",
  "roles": {
    "missionary": {
      "label": "Missionary",
      "sceneTitle": "At a front door",
      "sceneText": "You are visiting homes on a quiet street. You have a few minutes at each door.",
      "goal": "Start a short, friendly conversation."
    },
    "christian": {
      "label": "Christian",
      "sceneTitle": "At home",
      "sceneText": "You are at home on a quiet afternoon when someone comes to the door.",
      "goal": "Respond kindly and clearly in your own words."
    }
  },
  "interactionTrigger": {
    "initiatingRole": "missionary",
    "initiatorPrompt": "You have arrived at the front door.",
    "initiatorActionLabel": "Knock on the door",
    "receiverPrompt": "Someone is knocking at your door.",
    "receiverActionLabel": "Open the door"
  },
  "openingDialogue": {
    "speakerRole": "missionary",
    "script": "Hello. May I ask you one short question?",
    "listenerPrompt": "Listen, then answer naturally."
  },
  "questions": [
    {
      "id": "hope",
      "title": "What gives you hope?",
      "topicTag": "Hope",
      "missionaryScript": "What gives you hope when life is hard?",
      "christian": {
        "hint": "Keep it short and personal.",
        "hiddenAnswer": "I would keep my answer short and clear."
      },
      "followUps": [
        {
          "id": "add-more",
          "label": "Ask them to add more",
          "missionaryScript": "What would you add to that?",
          "christian": {
            "hiddenAnswer": "I would add one personal example."
          }
        }
      ]
    },
    {
      "id": "faith",
      "title": "What does faith mean to you?",
      "topicTag": "Faith",
      "missionaryScript": "What does faith mean to you?",
      "christian": {
        "hiddenAnswer": "I would answer in one or two sentences, in my own words."
      }
    }
  ],
  "conclusion": {
    "closingPrompt": "Thank you for your time. Have a good afternoon.",
    "reflectionPrompt": "What would you say differently next time?"
  },
  "sourceNotes": "Filler content that keeps the original sample link working in the guided format. No substantive script."
}
